Summary,Issue Type,Epic Name,Epic Link,Description,Priority,Labels
Build plugin discovery and loading system,Story,,Platform Core Architecture,"Implement a plugin loader that discovers game adapters at startup. Options: entry_points (setuptools); directory-based discovery (adapters/*.py); or explicit config. Support loading multiple adapters simultaneously for users who play multiple games.",Medium,platform
Create universal item model,Story,,Platform Core Architecture,"Define a game-agnostic Item data model that all adapters produce. Core fields: name; rarity; item_class; mods (list of Mod objects); stats (DPS/defense/etc); metadata. Game-specific fields go in an extras dict. This model is what the core engine operates on.",High,platform
Build shared caching infrastructure,Story,,Platform Core Architecture,"Extract the caching layer (price_cache; trade API cache; stat cache) into a shared module parameterized by game. Support: in-memory LRU; disk persistence; TTL configuration; cache warming; and size limits. Each adapter declares its cache needs.",Medium,platform
Build shared rate limiting infrastructure,Story,,Platform Core Architecture,"Extract the adaptive rate limiter from trade_client.py into a shared module. Support multiple rate limit windows per API; header-based discovery; proactive backoff; and per-game configuration. Critical for any game with trade API rate limits.",Medium,platform
Add game selection UI,Story,,Platform Core Architecture,"On startup (or in settings) let the user select which game(s) to activate. Auto-detect running games and suggest the right adapter. Support running multiple adapters simultaneously (e.g. POE2 + Last Epoch both installed).",Medium,platform
Multi-Game: Last Epoch,Epic,Multi-Game: Last Epoch,,"Build a Last Epoch adapter for the pricing platform. Last Epoch has a trade marketplace (Merchant's Guild) with a public-ish API; item affixes with tiers; and a community price tracking ecosystem (lastepochtools.com).",Medium,platform;last-epoch
Research Last Epoch item data format,Story,,Multi-Game: Last Epoch,"Investigate how Last Epoch exposes item data: clipboard format (if any); chat links; trade API item schema; affix/prefix/suffix system; crafting tiers. Identify the equivalent of POE2's clipboard Ctrl+C. Last Epoch may require screen capture + OCR or memory reading (check TOS).",Medium,last-epoch
Build Last Epoch item parser,Story,,Multi-Game: Last Epoch,"Implement parse_item() for Last Epoch. Handle: unique items; exalted items; set items; rare items with affixes. Map Last Epoch's affix tiers (T1-T7) to a scoring system. Handle sealed affixes and crafting potential.",Medium,last-epoch
Build Last Epoch price lookup,Story,,Multi-Game: Last Epoch,"Integrate with lastepochtools.com or the Merchant's Guild API for price data. Build a price cache similar to POE2's poe2scout integration. Handle Last Epoch's currency system (gold + faction standing).",Medium,last-epoch
Build Last Epoch mod scoring engine,Story,,Multi-Game: Last Epoch,"Score Last Epoch items based on affix tiers and synergies. Last Epoch has 7 affix tiers (T1 worst to T7 best in crafting; reversed for drops). Build tier ladders from game data. Factor in class-specific value (Sentinel affixes worth more to Sentinel players).",Medium,last-epoch
Multi-Game: Diablo 4,Epic,Multi-Game: Diablo 4,,"Build a Diablo 4 adapter for the pricing platform. D4 has no official trade API but has community tools and a seasonal economy. Item affixes have tiers and greater affixes are premium.",Low,platform;diablo4
Research Diablo 4 item data access,Story,,Multi-Game: Diablo 4,"Investigate how to access D4 item data: no clipboard copy exists natively. Options: screenshot + OCR of item tooltips; community API endpoints; third-party tools that expose item data. Check Blizzard TOS carefully. D4's seasonal model means item data formats may change frequently.",Low,diablo4
Build Diablo 4 item parser,Story,,Multi-Game: Diablo 4,"Implement parse_item() for Diablo 4. Handle: legendary items; unique items; greater affixes; tempering; masterworking tiers. D4's affix system is simpler than POE2 but greater affixes add significant complexity.",Low,diablo4
Build Diablo 4 affix scoring engine,Story,,Multi-Game: Diablo 4,"Score D4 items based on affix quality. Greater affixes are premium; masterworking upgrades add value; tempering results matter. Build a scoring system that understands class-specific value (different affixes matter for different builds).",Low,diablo4
Multi-Game: World of Warcraft,Epic,Multi-Game: World of Warcraft,,"Build a WoW adapter for the pricing platform. WoW has the Auction House API (Blizzard API); TSM (TradeSkillMaster) price data; and a mature economy. Focus on crafted gear; consumables; and BoE items.",Low,platform;wow
Research WoW Auction House API integration,Story,,Multi-Game: World of Warcraft,"Investigate Blizzard's AH API: authentication (OAuth); rate limits; data freshness; regional endpoints. Also evaluate TSM's API/addon data as an alternative price source. WoW items are identified by item_id + bonus_ids which is very different from POE2's text-based system.",Low,wow
Build WoW item price lookup,Story,,Multi-Game: World of Warcraft,"Integrate with Blizzard AH API and/or TSM for price data. Handle: realm-specific pricing; regional averages; historical pricing. WoW's economy is server-specific unlike POE2's league-wide economy.",Low,wow
Build WoW crafted gear scoring,Story,,Multi-Game: World of Warcraft,"Score WoW crafted gear based on item level; optional reagent choices; and embellishment slots. Factor in craft quality (1-5 stars) and resourcefulness procs. Different from POE2's mod-tier system but similar in concept.",Low,wow
Gaming Overlay SDK,Epic,Gaming Overlay SDK,,"Build a developer-facing SDK/framework that makes it easy to create game overlays. Package the core overlay engine; input monitoring; caching; and plugin system as a reusable library. Other developers can build their own game-specific tools on top.",Medium,sdk
Design SDK public API surface,Story,,Gaming Overlay SDK,"Define the public API that developers interact with: GameOverlay class; Adapter protocol; CacheManager; RateLimiter; InputMonitor; OverlayRenderer. Write API documentation with usage examples. Keep it minimal and opinionated — don't expose internal complexity.",Medium,sdk
Package core as installable library,Story,,Gaming Overlay SDK,"Restructure the project so the core engine is pip-installable: gaming-overlay-sdk on PyPI. Game adapters are separate packages (gaming-overlay-poe2; gaming-overlay-lastepoch). Use proper Python packaging (pyproject.toml; src layout).",Medium,sdk
Build example minimal adapter,Story,,Gaming Overlay SDK,"Create a minimal example adapter that demonstrates the SDK: a simple overlay that shows item names and fake prices for a hypothetical game. Serves as the 'hello world' for SDK developers. Include in docs/examples/.",Medium,sdk
Add overlay rendering backends,Story,,Gaming Overlay SDK,"Support multiple rendering backends beyond tkinter: PyQt/PySide (richer widgets; better DPI support); DirectX overlay (lower latency; game-native feel); Electron/web-based (cross-platform; rich UI). Adapter selects backend based on game requirements.",Low,sdk
Add cross-platform input monitoring,Story,,Gaming Overlay SDK,"Current input monitoring uses Win32 APIs (GetAsyncKeyState; keybd_event; GetCursorPos). Abstract behind a platform interface and add Linux support (X11/Wayland) and macOS support (Quartz). Critical for cross-platform SDK.",Low,sdk
Write SDK developer documentation,Story,,Gaming Overlay SDK,"Comprehensive docs: getting started guide; adapter development tutorial; API reference; architecture overview; deployment guide. Host on GitHub Pages or ReadTheDocs. Include cookbook recipes for common patterns.",Medium,sdk
Add overlay widget library,Story,,Gaming Overlay SDK,"Pre-built UI components for common overlay patterns: price tag; grade badge; progress bar; mini-chart (sparkline); icon+text combo; tooltip panel; notification toast. Developers compose these instead of building from scratch.",Low,sdk
Data Platform and Analytics,Epic,Data Platform and Analytics,,"Build shared data infrastructure that serves all game adapters: centralized price history; cross-game analytics; user portfolio tracking; and market intelligence. Could evolve into a hosted service.",Low,platform;data
Design cross-game price data schema,Story,,Data Platform and Analytics,"Define a universal schema for storing price data across games: item_id; game; realm/league; price; currency; timestamp; source. Support multiple price sources per item. Use SQLite locally with option to migrate to PostgreSQL for hosted service.",Low,data
Build local analytics database,Story,,Data Platform and Analytics,"Replace the scattered JSONL files (calibration.jsonl; bug_reports.jsonl) with a proper local SQLite database. Tables: items_scanned; price_history; calibration_samples; user_settings; session_stats. Enables rich querying and dashboards.",Medium,data
Add session profit tracker,Story,,Data Platform and Analytics,"Track items found and sold per session. Show: total estimated value found; items by grade; most valuable drop; estimated chaos/hour. Persist across sessions for long-term tracking. Works across all games via the universal item model.",Low,data
Add cross-game portfolio dashboard,Story,,Data Platform and Analytics,"A standalone dashboard showing wealth across all supported games: POE2 stash value; Last Epoch stash value; WoW AH listings. Unified view of gaming portfolio. Could be a local GUI or a web dashboard.",Low,data
Monetization and Sustainability,Epic,Monetization and Sustainability,,"Explore sustainable revenue models that keep the core tool free while funding development. Covers premium features; hosted services; and sponsorships.",Low,business
Research premium feature model,Story,,Monetization and Sustainability,"Identify features that could be premium (paid) without making the free tier feel crippled. Candidates: cross-game support; cloud price history; advanced analytics; priority API access; custom overlay themes. The core single-game pricing must remain free.",Low,business
Explore hosted price API service,Story,,Monetization and Sustainability,"Evaluate offering a hosted API that aggregates price data across games and serves it to third-party tools. Revenue via API key tiers (free: 100 req/day; pro: 10k req/day; enterprise: unlimited). Requires infrastructure investment.",Low,business
Add Patreon/GitHub Sponsors tier structure,Story,,Monetization and Sustainability,"Set up tiered sponsorship with meaningful benefits: Supporter ($3/mo) = name in credits; Pro ($10/mo) = early access to new game adapters; Patron ($25/mo) = vote on feature priority. Keep it sustainable not exploitative.",Low,business
