Summary,Issue Type,Epic Name,Epic Link,Description,Priority,Labels
Pricing Engine Accuracy,Epic,Pricing Engine Accuracy,,Improve the accuracy and intelligence of item pricing across all item types. Covers mod classification improvements; ilvl awareness; resistance valuation; calibration bootstrapping; and synergy detection.,High,pricing
Add per-slot ilvl breakpoint tables,Story,,Pricing Engine Accuracy,"Different equipment slots have different ilvl breakpoints for top-tier mods (e.g. bows need ilvl 82 for top phys% but wands only need 81). Build per-slot breakpoint tables and factor ilvl into loot filter tiering for exceptional bases. Data source: RePoE mod tiers.",Medium,pricing
Improve common mod classification heuristic,Story,,Pricing Engine Accuracy,"Current common mod classification is heuristic-based and may occasionally misclassify an unusual valuable mod as 'common'. Investigate data-driven approaches: use RePoE tier data to determine if a mod is valuable based on its tier rank rather than pattern matching. Consider using the mod_database weight table as the source of truth.",Medium,pricing
Handle Grants Skill edge cases,Story,,Pricing Engine Accuracy,"Unusual 'Grants Skill:' formats might not be stripped by _SKIP_LINE_RE in trade_client.py and could leak into trade queries. Audit all skill grant formats in the game data and expand the regex to cover edge cases.",Low,pricing
Add Resistance SOMV scoring,Story,,Pricing Engine Accuracy,"High resistance rolls add real value beyond what the trade query captures. If a resist mod is above 40% (fire/cold/lightning) or 20% (chaos) calculate a sum-of-mod-value bonus and factor it into the score. Could be a multiplier or flat addition to help differentiate e.g. a ring with 43% fire res from one with 20%.",Medium,pricing
Ship pre-built calibration data shard,Story,,Pricing Engine Accuracy,"Ship a curated calibration.jsonl with the repo so new users get reasonable price estimates from day one. Consider league-aware shards since calibration data from one league may not apply to another. Update periodically as more data is collected.",Medium,pricing
Add multi-mod synergy detection,Story,,Pricing Engine Accuracy,"Certain mod combinations are worth more together than the sum of their parts (e.g. %increased phys + flat phys on weapons or +life + all res on jewelry). Detect known synergy pairs and apply a score multiplier when both are present.",Medium,pricing
Add jewel and charm scoring support,Story,,Pricing Engine Accuracy,"Jewels and charms have different valuable mod pools than equipment. Extend mod_database weight tables to cover jewel-specific mods (e.g. crit multi; life; damage) and charm-specific mods (duration; effect). Currently these item classes may get inaccurate grades.",Medium,pricing
Add influence and fractured mod value recognition,Story,,Pricing Engine Accuracy,"Fractured mods lock a guaranteed roll which significantly increases item value. Influence mods (if POE2 adds them) similarly add value. Score_item should apply a bonus multiplier when fractured mods are present especially for T1-T2 fractured rolls.",Medium,pricing
Overlay Visual Polish,Epic,Overlay Visual Polish,,Make the price overlay more visually appealing and informative. Covers currency icons; game-native styling; celebration effects; and improved dismiss/scrap indicators.,Medium,overlay
Show currency icons next to price text,Story,,Overlay Visual Polish,"Display small currency images (Divine; Exalted; Chaos orb icons) next to the price text in the overlay instead of just the currency name string. Makes prices instantly recognizable at a glance. Will need to bundle small PNG sprites and render them in tkinter.",Medium,overlay
Show chanceable base icons,Story,,Overlay Visual Polish,"When a chanceable normal base is detected show a Chance Orb icon and the target unique's icon/art in the overlay alongside the text. Visual support for the existing chanceable base detection feature.",Low,overlay
Upgrade dismiss indicator,Story,,Overlay Visual Polish,"Current ✗ dismiss is plain Unicode in grey. Explore nicer options: custom icon; styled background; subtle animation; or a brief flash before disappearing. Should be quick to read but not distracting.",Low,overlay
Add scrap indicator for quality/socketed dismissed items,Story,,Overlay Visual Polish,"Items dismissed as ✗ that have quality% or sockets should show a scrap/hammer icon instead reminding players to break them down for etchers; armour scraps; whetstones; baubles; gemcutters. These crafting materials are valuable for upgrades and currency exchange.",Low,overlay
Implement game-native visual style,Story,,Overlay Visual Polish,"Make the price overlay look like part of the POE2 game UI — matching fonts (FontinSmallCaps or similar); dark translucent panel styling; gold/brown borders similar to tooltip frames. Even though it's a separate overlay it should feel integrated.",Medium,overlay
Add high-value visual celebration,Story,,Overlay Visual Polish,"Stronger visual feedback when something is high value. Ideas: particle/glow effects around the price tag; brief screen-edge flash; optional sound alert (cha-ching). Should be toggleable. The rainbow mirror-tier effect already exists — extend for other thresholds.",Low,overlay
Add compact vs expanded overlay mode,Story,,Overlay Visual Polish,"Toggle between a compact mode (just price + grade) and an expanded mode (price + grade + top mods + tier breakdown + DPS/defense). Compact is default for speed; expanded for learning. Could be triggered by holding Shift while hovering.",Medium,overlay
Show mod tier labels in expanded overlay,Story,,Overlay Visual Polish,"In expanded overlay mode show T1/T2/T3 labels next to each mod line. Uses the existing mod_database tier ladder data. Helps players learn which mods are the valuable ones driving the grade.",Medium,overlay
Desktop Application,Epic,Desktop Application,,Transform from bat-file scripts into a proper Windows desktop application with system tray; settings GUI; auto-launch; installer; and auto-updater.,Medium,app
Add system tray integration,Story,,Desktop Application,"Minimize to system tray instead of keeping a console window open. Tray icon should show status (active/paused/error). Right-click menu: Show Console; Settings; Pause/Resume; Exit. Double-click to show/hide console.",Medium,app
Build settings GUI,Story,,Desktop Application,"Replace SETTINGS.bat with a proper tkinter or PyQt settings window. Sections: League selection; overlay appearance (colors; font size; duration; position offset); hotkey configuration; loot filter settings; advanced (scan FPS; API rate limits). Save to a config file that main.py reads on startup.",Medium,app
Add auto-launch with POE2 detection,Story,,Desktop Application,"Detect when POE2 launches and automatically start the overlay. Options: Windows Task Scheduler trigger; lightweight tray service that polls for PathOfExile2.exe; or Windows WMI process creation events. Should also auto-pause when POE2 exits.",Low,app
Create Windows installer,Story,,Desktop Application,"Build a proper installer using NSIS; Inno Setup; or PyInstaller+NSIS. Should handle Python bundling (or detect existing Python); create Start Menu shortcut; optionally add to startup; set up file associations. Removes the 'install Python and Git' barrier for new users.",Medium,app
Add auto-updater,Story,,Desktop Application,"Check GitHub releases on startup for new versions. Show a notification if an update is available with a one-click update button. Could use GitHub API to compare version tags. Should handle the update gracefully (download; extract; restart).",Low,app
Improve first-run setup wizard,Story,,Desktop Application,"Current launcher.py has basic first-run flow. Enhance with: visual league selector (with league icons/dates); account name entry for trade API; overlay position test (show sample price tag and let user drag it); brief feature tour.",Low,app
Testing and Quality,Epic,Testing and Quality,,Build comprehensive automated testing and CI/CD pipeline. Covers migration to pytest; regression suites for all major components; and cross-platform validation.,High,testing
Migrate to pytest framework,Story,,Testing and Quality,"Current test_pipeline.py and mod_database.py self-tests are ad-hoc. Migrate to proper pytest with fixtures; parametrized tests; and clear pass/fail reporting. Set up conftest.py with shared fixtures for mock items; parsed mods; etc.",High,testing
Add mod_database scoring regression suite,Story,,Testing and Quality,"Extend the existing 34 test cases into a comprehensive regression suite covering: all grade boundaries (S/A/B/C/JUNK); DPS factor curves; defense factor curves; weight table edge cases; unknown mod fallback; per-item-class behavior. Target: 100+ test cases.",High,testing
Add mod_parser stat matching tests,Story,,Testing and Quality,"Test suite for mod_parser.py: regex compilation coverage; mod text → stat_id matching accuracy; value extraction; mod_type preservation (rune stays rune; fractured stays fractured). Use real clipboard samples from the debug archive as fixtures.",Medium,testing
Add item_parser clipboard parsing tests,Story,,Testing and Quality,"Test suite for item_parser.py: parsing all item classes (weapons; armor; jewelry; currency; gems; maps); edge cases (unidentified; corrupted; mirrored; fractured); section separator handling; DPS and defense extraction accuracy.",Medium,testing
Add trade_client query building tests,Story,,Testing and Quality,"Test suite for trade_client.py: query JSON structure validation; progressive search strategy; common mod filtering; value-dependent minimums; DPS/defense equipment_filters; outlier trimming; rate limiting behavior. Mock the HTTP layer.",Medium,testing
Add end-to-end pipeline integration tests,Story,,Testing and Quality,"Full pipeline tests: clipboard text → parse → score → price lookup → overlay display text. Use archived clipboard captures as input and validate the complete output chain. Should catch regressions in the interaction between components.",Medium,testing
Set up GitHub Actions CI,Story,,Testing and Quality,"Configure CI to run the full test suite on every push and PR. Include: pytest run; linting (ruff or flake8); type checking (mypy optional). Badge in README showing build status.",Medium,testing
Add cross-platform and resolution testing,Story,,Testing and Quality,"Test and document behavior across different setups: 1080p; 1440p; 4K; ultrawide; multi-monitor with various DPI settings. The overlay positioning and screen boundary detection in overlay.py need validation. Create a test matrix.",Low,testing
Loot Filter Intelligence,Epic,Loot Filter Intelligence,,Enhance the loot filter auto-updater with smarter economy-driven tiering; user overrides; and better UX around filter changes.,Medium,filter
Add per-base-type value thresholds,Story,,Loot Filter Intelligence,"Current filter tiering uses broad category thresholds. Add per-base-type awareness so e.g. a Heavy Belt (chanceable to Headhunter) gets special treatment even though 'normal belts' as a category are hidden.",Medium,filter
Add user-configurable tier overrides,Story,,Loot Filter Intelligence,"Let users pin specific items to always-show or always-hide regardless of economy data. Persist overrides in a local config file. Useful for SSF players or niche builds that value items differently from the trade economy.",Medium,filter
Add filter diff preview before applying,Story,,Loot Filter Intelligence,"Before writing the updated filter show the user a summary of what changed: items promoted; items demoted; new items added. Let them approve or reject the update. Could be a console summary or a GUI diff view.",Medium,filter
Support multiple filter profiles,Story,,Loot Filter Intelligence,"Allow users to maintain multiple filter profiles (e.g. Strict; Semi-Strict; Relaxed) that all get economy-updated. Each profile has different base thresholds but the same economy data drives the tiering.",Low,filter
Add real-time filter reload notification,Story,,Loot Filter Intelligence,"After updating the filter file notify the user to reload in-game. If possible detect when the game has reloaded the filter (file access timestamp) and confirm. Show a brief overlay notification: 'Filter updated — reload in game'.",Low,filter
User Configuration and Customization,Epic,User Configuration and Customization,,Give users control over how the tool behaves and displays information. Covers mod classification UI; hotkey customization; display preferences; and per-league profiles.,Medium,config
Build user-configurable mod classification UI,Story,,User Configuration and Customization,"Expose the common/key/premium mod weight lists as a toggleable UI (checkboxes or radio buttons per mod). Lets users override defaults; adapt to meta shifts; and adjust per-league without code changes. Addresses the 'we can not be right for everyone' problem with heuristic classification.",Medium,config
Add hotkey customization,Story,,User Configuration and Customization,"Let users rebind the scan trigger (currently cursor-stop-based Ctrl+C); deep query (Ctrl+Shift+C); and bug report (Ctrl+Shift+B) hotkeys. Store in config file. Validate no conflicts with game bindings.",Low,config
Add price display format options,Story,,User Configuration and Customization,"Let users choose their preferred price display: Divine only; Chaos only; both; or auto (divine for expensive items; chaos for cheap). Currently hardcoded thresholds in price_cache.py and config.py.",Low,config
Add notification threshold settings,Story,,User Configuration and Customization,"Let users set minimum value thresholds for when the overlay appears. E.g. 'only show for items worth 1+ divine' to reduce noise while mapping. Could have different thresholds for different activities (mapping vs stash sorting).",Medium,config
Add per-league settings profiles,Story,,User Configuration and Customization,"When switching leagues auto-load league-specific settings (different filter profiles; calibration data; price thresholds). Useful when playing both trade and SSF or standard vs league.",Low,config
Stash Management,Epic,Stash Management,,Add stash tab scanning and value tracking features for bulk item management.,Medium,stash
Add bulk stash tab scanning mode,Story,,Stash Management,"Scan an entire stash tab by moving cursor across all item slots systematically. Could be manual (user moves cursor) with rapid-fire Ctrl+C or semi-automated (tool moves cursor in a grid pattern). Show running value total.",Medium,stash
Add tab value summary dashboard,Story,,Stash Management,"After scanning a stash tab show a summary: total estimated value; breakdown by grade (S/A/B/C items); top 5 most valuable items; count of junk items to vendor. Could be a console table or a GUI panel.",Medium,stash
Add price tag persistence for scanned items,Story,,Stash Management,"Remember prices for items in specific stash positions so returning to a previously-scanned tab shows cached prices instantly without re-querying. Key by stash tab name + grid position + item hash.",Low,stash
Add stash tab value tracking over time,Story,,Stash Management,"Track the total value of scanned stash tabs over time. Show a simple trend: 'Dump tab: 45 divine (up from 38 divine yesterday)'. Helps players see their wealth accumulation. Store in a local database.",Low,stash
Price Intelligence and Trends,Epic,Price Intelligence and Trends,,Track and display price trends over time. Help users understand market movements and make better trading decisions.,Low,analytics
Add price history tracking,Story,,Price Intelligence and Trends,"Store historical price snapshots for items over time (hourly or per-refresh from poe2scout). Build a local time-series database (SQLite or JSONL). Enables trend analysis and alerts.",Low,analytics
Show trend arrows in overlay,Story,,Price Intelligence and Trends,"Display up/down/stable trend arrows next to prices in the overlay based on 24h price movement. Green up-arrow if price increased 10%+; red down-arrow if decreased 10%+; dash if stable. Quick visual signal for buy/sell decisions.",Low,analytics
Add league economy dashboard,Story,,Price Intelligence and Trends,"A standalone view (console or GUI) showing: top movers (biggest price changes); most expensive items; currency exchange rate trends; chaos:divine:exalted ratio over time. Useful for market-savvy players.",Low,analytics
Add price alert notifications,Story,,Price Intelligence and Trends,"Let users watchlist specific items and get notified when prices cross thresholds. E.g. 'Alert me when Divine Orbs drop below 20 chaos'. Show as overlay notification or system tray popup.",Low,analytics
Build Integration,Epic,Build Integration,,Connect with Path of Building and build planners to provide build-aware item evaluation.,Low,build
Add Path of Building import,Story,,Build Integration,"Import the user's current build from a PoB pastebin or .xml file. Extract: equipped gear; skill gems; passive tree. Use this to understand which stats the player values most.",Low,build
Add build-aware mod weighting,Story,,Build Integration,"When a build is imported adjust mod weights based on what the build actually uses. E.g. a cold DoT build values +cold damage over time multiplier much more than a generic weight table suggests. Override the default mod_database weights with build-specific values.",Low,build
Show upgrade suggestions,Story,,Build Integration,"Compare scanned items against currently equipped gear from the imported build. Highlight when a dropped item is a direct upgrade: 'Upgrade! +15% more DPS than equipped weapon'. Requires build DPS/EHP calculation or PoB integration.",Low,build
Trade Workflow,Epic,Trade Workflow,,Streamline the trading experience with whisper generation; listing helpers; and trade history.,Medium,trade
Add quick whisper message generation,Story,,Trade Workflow,"After pricing an item via the trade API offer a 'copy whisper' option that generates the standard POE2 trade whisper message for the cheapest comparable listing. Copy to clipboard with a hotkey (e.g. Ctrl+Shift+W).",Medium,trade
Add trade listing price suggestion,Story,,Trade Workflow,"When the user wants to sell an item suggest an asking price based on the trade API results. Show: undercut price (sell fast); market price (fair); premium price (if top rolls). Help players who don't know what to list for.",Medium,trade
Add price check history log,Story,,Trade Workflow,"Keep a running log of all items price-checked in the current session. Show as a scrollable list in a separate window or console view. Include: item name; grade; price; timestamp. Useful for reviewing what you've scanned.",Medium,trade
Add bulk currency trade support,Story,,Trade Workflow,"Support pricing bulk currency trades: 'I have 500 Jeweller's Orbs — what are they worth in Divine?'. Use poe.ninja exchange rates for instant bulk valuation. Show in overlay when hovering currency stacks.",Low,trade
Advanced Item Analysis,Epic,Advanced Item Analysis,,Deep item analysis features for experienced players: crafting advice; corruption analysis; and item comparison.,Low,analysis
Add crafting advisor,Story,,Advanced Item Analysis,"For rare items with open affixes suggest next crafting steps: 'Slam for life prefix' or 'Annul the mana suffix'. Use the mod_database tier data to identify which mods are worth keeping vs removing. Show in expanded overlay mode.",Low,analysis
Add corruption outcome analysis,Story,,Advanced Item Analysis,"For unique items show the value range of corruption outcomes: implicit swap values; 6-link chance; brick to rare risk. Use trade API data for corrupted variants. Help players decide whether to Vaal an item.",Low,analysis
Add item comparison mode,Story,,Advanced Item Analysis,"Side-by-side comparison of two items: scan item A then item B and see a comparison overlay showing which mods are better/worse; DPS/defense difference; and price difference. Useful for choosing between two drops.",Low,analysis
Add mirror-tier item detection,Story,,Advanced Item Analysis,"Detect items that are near-perfect rolls across all mods (T1 in 5+ mods with high rolls). Show a special indicator: 'Near-mirror tier' with an estimated mirror-service price. These items are worth far more than the sum of their mods.",Low,analysis
Performance and Reliability,Epic,Performance and Reliability,,Improve startup time; memory usage; error recovery; and offline capability. Ensure the tool is rock-solid for daily use.,High,reliability
Optimize startup time,Story,,Performance and Reliability,"Profile and optimize the startup sequence. Currently loads price cache; trade stats; mod parser; mod database; and calibration serially. Parallelize independent loads. Target: under 5 seconds from launch to 'Ready'.",Medium,reliability
Add graceful API degradation,Story,,Performance and Reliability,"When poe2scout; poe.ninja; or the trade API are down the tool should continue working with cached data and clearly indicate staleness. Show 'Cached prices (2h old)' instead of failing. Currently a failed refresh may leave stale data without warning.",High,reliability
Add offline mode,Story,,Performance and Reliability,"Support fully offline operation using last-known cached prices and local mod scoring. Useful for SSF players or when internet is unstable. Local scoring already works offline — extend price_cache to serve stale data gracefully.",Medium,reliability
Migrate debug archive to network store,Story,,Performance and Reliability,"Currently debug archives are stored locally in archive/ and are .gitignore'd. Migrate to a network-accessible store (S3; Azure Blob; or a simple file server) so archives can be shared across machines and with collaborators for debugging.",Low,reliability
Add memory usage profiling and limits,Story,,Performance and Reliability,"Profile memory usage during long sessions (4+ hours). The price cache; trade cache; calibration data; and mod database all grow over time. Add cache size limits and eviction policies. Log memory usage in status reports.",Low,reliability
Improve error recovery and auto-restart,Story,,Performance and Reliability,"When a component crashes (e.g. trade thread exception; overlay error) attempt to restart it automatically instead of requiring a full app restart. Add a watchdog thread that monitors component health.",Medium,reliability
Community and Distribution,Epic,Community and Distribution,,Prepare the project for public release and community engagement. Covers GitHub releases; documentation; contribution guide; and monetization.,Low,community
Set up GitHub releases with versioned binaries,Story,,Community and Distribution,"Create tagged releases on GitHub with PyInstaller-bundled executables. Users can download a single .exe or .zip without installing Python. Set up a release workflow in GitHub Actions.",Medium,community
Write contribution guide,Story,,Community and Distribution,"Create CONTRIBUTING.md with: project setup instructions; coding standards; PR process; how to run tests; architecture overview for new contributors. Lower the barrier for community contributions.",Low,community
Add Buy Me a Coffee integration,Story,,Community and Distribution,"Add a subtle 'Support this project' link in the settings UI and README that connects to Buy Me a Coffee or GitHub Sponsors. Should be completely unobtrusive — never shown in the overlay during gameplay.",Low,community
Set up Discord community server,Story,,Community and Distribution,"Create a Discord server for users: channels for support; bug reports; feature requests; and development discussion. Bug reporter already posts to Discord — extend with a community-facing server.",Low,community
Add opt-in anonymous usage analytics,Story,,Community and Distribution,"Collect anonymized usage data (items scanned per session; grades distribution; feature usage; crash reports) to guide development priorities. Must be opt-in with clear privacy explanation. No item data or account info.",Low,community
Add changelog automation,Story,,Community and Distribution,"Auto-generate changelogs from git commit history or PR descriptions for each release. Could use conventional commits format or a GitHub Action that compiles PR titles into CHANGELOG.md.",Low,community
Platform Core Architecture,Epic,Platform Core Architecture,,"Refactor the POE2 overlay into a game-agnostic platform with a plugin/adapter architecture. The core engine handles overlay rendering; input monitoring; caching; and rate limiting. Game-specific logic (item parsing; trade APIs; mod scoring) lives in swappable adapters. This is the foundation for multi-game support.",High,platform
Extract game-agnostic overlay engine,Story,,Platform Core Architecture,"Separate the overlay rendering (overlay.py) into a standalone module with no POE2-specific logic. The engine should accept: text; tier/color; position; animation config. Games provide display data; the engine renders it. Support theming so each game adapter can style the overlay differently.",High,platform
Define game adapter interface,Story,,Platform Core Architecture,"Design and implement the adapter protocol/ABC that each game must implement: parse_item(clipboard_text) -> Item; score_item(item) -> Score; lookup_price(item) -> Price; get_trade_url(item) -> str; get_window_title() -> str; get_currency_types() -> list. Document the contract clearly.",High,platform
Extract POE2 adapter from monolith,Story,,Platform Core Architecture,"Refactor the current codebase into the first game adapter. Move all POE2-specific code (item_parser; mod_parser; mod_database; trade_client; price_cache; filter_updater) into a poe2/ adapter package that implements the game adapter interface. Core engine imports it as a plugin.",High,platform
